"topic","detail"
"api_update","Deprecated exdqlmChecks replaced with exdqlmDiagnostics."
"api_update","Deprecated y= usage removed from exdqlmPlot/compPlot/exdqlmForecast calls."
"ldvb_note","Added ISVB vs LDVB comparison figure for dynamic Sunspots example."
"backend","MCMC runs use C++ backend options exdqlm.use_cpp_mcmc=TRUE and exdqlm.cpp_mcmc_mode='fast'."
"ex1","Lake Huron uses cached fits; ex1mcmc uses a dedicated high-iteration median MCMC chain."
"coverage","Targeted run; requested targets: ex1mcmc."
"timing","Exact runtime printouts in manuscript are historical and expected to differ."
"scope","Main manuscript .tex was not modified; all updates are isolated under analysis/manuscript."
